{
  "$schema": "../metadata/builds.schema.json",
  "schemaVersion": 1,
  "version": "2.2.0",
  "reproducibility": {
    "deterministic": true,
    "integrityAlgorithm": "sha256",
    "verificationCommand": "npm run verify:reproducible"
  },
  "minifier": {
    "name": "esbuild",
    "version": "0.28.2",
    "targets": [
      "chrome100",
      "firefox100",
      "safari15.4"
    ],
    "legalComments": "inline",
    "sourceMaps": true,
    "sourceMapPolicy": "primary-and-custom"
  },
  "compression": {
    "gzipLevel": 9,
    "brotliQuality": 11
  },
  "componentSelection": {
    "granularity": "owning-pack",
    "dependencyPolicy": "include-pack-peers",
    "runtimePolicy": "full-runtime",
    "command": "npm run build:custom -- --components button,card,dialog --out dist/custom/ui"
  },
  "platforms": [
    {
      "name": "web",
      "cssProfile": "web",
      "cssDependencies": [],
      "css": null,
      "minCss": "platforms/gardener.web.min.css",
      "runtime": "gardener.runtime.min.js",
      "adapters": [],
      "packs": [
        "layouts",
        "regions",
        "primitives",
        "grid",
        "basic",
        "forms",
        "form-compositions",
        "navigation",
        "navigation-compositions",
        "feedback",
        "data",
        "data-compositions",
        "selection-compositions",
        "content-compositions",
        "auth-compositions",
        "commerce-compositions",
        "extended",
        "page",
        "help",
        "recipes",
        "solution-compositions",
        "catalog",
        "ai",
        "ai-extended",
        "ai-compositions"
      ],
      "platforms": [
        "web",
        "tablet",
        "print",
        "pwa"
      ],
      "components": [
        "button",
        "button-group",
        "card",
        "badge",
        "tag",
        "chip",
        "badge-tag-chip",
        "avatar",
        "avatar-group",
        "alert",
        "progress-meter",
        "spinner-skeleton",
        "empty-state",
        "input",
        "textarea",
        "select",
        "checkbox-radio",
        "switch",
        "range-color",
        "file-drop",
        "combobox",
        "form",
        "form-section",
        "field",
        "fieldset",
        "form-row",
        "form-grid",
        "horizontal-form",
        "inline-form",
        "compact-form",
        "input-group",
        "input-affix",
        "search-field",
        "password-field",
        "clearable-field",
        "character-counter",
        "validation-state",
        "checkbox-group",
        "radio-group",
        "switch-row",
        "choice-card-group",
        "name-group",
        "address-group",
        "phone-group",
        "money-group",
        "date-range-group",
        "time-range-group",
        "unit-field",
        "range-field",
        "file-field",
        "repeatable-field",
        "conditional-field",
        "form-actions",
        "autosave-status",
        "form-progress",
        "form-review",
        "consent-group",
        "navbar",
        "sidebar",
        "breadcrumb",
        "tabs",
        "segmented-control",
        "pagination",
        "menu-dropdown",
        "stepper",
        "command-palette",
        "primary-navigation",
        "utility-navigation",
        "sub-navigation",
        "collapsible-navigation",
        "navigation-rail",
        "activity-bar",
        "menu-bar",
        "context-menu",
        "tree-navigation",
        "vertical-tabs",
        "pill-navigation",
        "scrollspy-navigation",
        "cursor-pagination",
        "load-more-navigation",
        "wizard-navigation",
        "back-navigation",
        "previous-next-navigation",
        "skip-navigation",
        "mobile-top-navigation",
        "bottom-navigation",
        "mobile-tab-bar",
        "drawer-navigation",
        "command-navigation",
        "jump-navigation",
        "quick-navigation",
        "locale-navigation",
        "account-navigation",
        "dialog",
        "drawer",
        "popover",
        "tooltip",
        "popconfirm",
        "confirm-dialog",
        "toast",
        "accordion",
        "table",
        "data-grid",
        "kpi-stat",
        "description-list",
        "descriptions",
        "list",
        "list-group",
        "tree",
        "timeline",
        "responsive-table",
        "table-sort",
        "row-selection",
        "row-disclosure",
        "column-toggle",
        "data-filter",
        "data-view",
        "editable-grid",
        "tree-table",
        "grouped-table",
        "expandable-table",
        "comparison-table",
        "key-value",
        "record-detail",
        "media-list",
        "dense-list",
        "audit-log-composition",
        "stat-list",
        "metric-card",
        "sparkline",
        "progress-stats",
        "data-legend",
        "ranking",
        "status-summary",
        "data-matrix",
        "heatmap",
        "data-toolbar",
        "column-chooser",
        "saved-views",
        "export-panel",
        "data-state",
        "data-view-switcher",
        "selection-summary",
        "table-density",
        "filter-summary",
        "sort-builder",
        "data-inspector",
        "selection-controls",
        "batch-toolbar",
        "dual-list",
        "tree-select",
        "cascader",
        "mention-picker",
        "user-picker",
        "organization-picker",
        "resource-picker",
        "media-picker",
        "icon-picker",
        "color-picker-composition",
        "date-range-picker-composition",
        "time-range-picker-composition",
        "saved-filters",
        "group-builder",
        "entity-picker",
        "tag-picker",
        "relation-picker",
        "bulk-confirmation",
        "bulk-progress",
        "filter-bar",
        "code-block",
        "terminal",
        "diff-viewer",
        "chart-container",
        "grid-system",
        "region-layout-system",
        "classic-layout-primitives",
        "page-header",
        "section-header",
        "subheader",
        "toolbar",
        "action-bar",
        "status-bar",
        "command-bar",
        "context-bar",
        "bulk-action-bar",
        "footer-bar",
        "floating-action-bar",
        "divider-with-text",
        "sticky-actions",
        "page-loading",
        "page-state-system",
        "tip",
        "inline-hint",
        "help-text",
        "help-trigger",
        "rich-tooltip",
        "help-popover",
        "definition-help",
        "callout",
        "note",
        "guidance-pair",
        "key-hint",
        "shortcut-list",
        "help-card",
        "help-panel",
        "help-center",
        "help-topics",
        "faq",
        "contextual-help",
        "coach-mark",
        "spotlight",
        "hotspot",
        "feature-hint",
        "whats-new",
        "help-checklist",
        "troubleshooting",
        "help-feedback",
        "app-shell",
        "dashboard",
        "mobile-shell",
        "chat",
        "message",
        "prompt-composer",
        "attachment",
        "thinking",
        "tool-call",
        "tool-approval",
        "agent-status",
        "agent-plan",
        "sources-citations",
        "artifact-panel",
        "model-selector",
        "context-meter",
        "voice-state",
        "generation-placeholder",
        "ai-workspace",
        "prompt-starter",
        "ai-command-menu",
        "streaming-response",
        "multi-agent-board",
        "agent-handoff",
        "artifact-workspace",
        "generation-gallery",
        "ai-context-manager",
        "ai-usage-panel",
        "ai-safety-notice",
        "ai-feedback",
        "date-picker",
        "time-picker",
        "pin-input",
        "rating",
        "transfer-list",
        "validation-summary",
        "mega-menu",
        "anchor-navigation",
        "tour-spotlight",
        "virtual-list",
        "kanban",
        "gantt-shell",
        "query-builder",
        "carousel",
        "gallery-lightbox",
        "media-player",
        "document-viewer",
        "split-pane",
        "drag-sort",
        "infinite-scroll",
        "pull-refresh",
        "product-card",
        "cart-item",
        "price-quantity",
        "conversation-list",
        "prompt-library",
        "mention-slash-command",
        "generation-card",
        "file-tree",
        "version-history",
        "permission-scope",
        "cost-rate-limit",
        "privacy-notice",
        "authentication-shell",
        "mobile-category",
        "cms-shell",
        "visual-builder",
        "rich-editor",
        "media-library",
        "content-workflow",
        "localization-grid",
        "site-header",
        "hero",
        "pricing",
        "article-layout",
        "product-detail",
        "checkout",
        "enterprise-settings",
        "permission-matrix",
        "audit-log",
        "onboarding",
        "wizard-layout",
        "notification-center",
        "inbox",
        "search-results",
        "calendar",
        "agenda",
        "file-manager",
        "upload-queue",
        "form-builder",
        "filter-builder",
        "pivot-table",
        "organization-chart",
        "map-shell",
        "comment-thread",
        "activity-feed",
        "report-invoice",
        "cookie-consent",
        "copy-action",
        "fullscreen-action",
        "back-to-top",
        "image-crop-shell",
        "content-file-drop",
        "content-file-list",
        "content-upload-queue",
        "chunk-upload",
        "upload-progress-composition",
        "failed-upload",
        "file-card-composition",
        "folder-tree-composition",
        "file-browser-composition",
        "file-preview-composition",
        "media-library-composition",
        "media-grid-composition",
        "media-details-composition",
        "image-crop-composition",